{
  "$schema": "../schema.json",
  "schemaVersion": 1,
  "pokemon": {
    "id": "castform-rainy",
    "dexNumber": 351,
    "displayName": "ポワルン（あまみず）",
    "name": {
      "en": "Castform",
      "ja": "ポワルン（あまみず）",
      "jaHrkt": "ポワルン（あまみず）"
    },
    "championsTarget": true,
    "types": [
      "water"
    ],
    "baseStats": {
      "hp": 70,
      "atk": 70,
      "def": 70,
      "spa": 70,
      "spd": 70,
      "spe": 70
    },
    "isFinalEvolution": true
  },
  "learnset": {
    "moveIds": [
      "avalanche",
      "blizzard",
      "body-slam",
      "chilling-water",
      "clear-smog",
      "double-edge",
      "ember",
      "energy-ball",
      "facade",
      "fire-blast",
      "flamethrower",
      "future-sight",
      "headbutt",
      "hex",
      "hidden-power",
      "hurricane",
      "hydro-pump",
      "ice-beam",
      "icy-wind",
      "incinerate",
      "last-resort",
      "ominous-wind",
      "powder-snow",
      "retaliate",
      "round",
      "scald",
      "secret-power",
      "shadow-ball",
      "shock-wave",
      "snore",
      "solar-beam",
      "swift",
      "tackle",
      "thief",
      "thunder",
      "thunderbolt",
      "water-gun",
      "water-pulse",
      "weather-ball"
    ],
    "specialMoves": [],
    "verification": {
      "status": "inherited-unverified",
      "sources": [],
      "verifiedMoveIds": [],
      "rejectedMoveIds": [],
      "notes": []
    }
  },
  "weight": {
    "kg": 0.8,
    "verification": {
      "status": "verified",
      "sources": [
        "https://pokeapi.co/api/v2/pokemon/castform-rainy"
      ],
      "notes": [
        "PokéAPIのweight（ヘクトグラム）をkgへ換算。"
      ]
    }
  },
  "abilities": [],
  "battleEffects": [],
  "research": {
    "profileStatus": "inherited-unverified",
    "battleEffectsStatus": "inherited-unverified",
    "sources": [],
    "notes": []
  },
  "extensions": {}
}
