{
  "$schema": "../schema.json",
  "schemaVersion": 1,
  "pokemon": {
    "id": "arcanine",
    "dexNumber": 59,
    "displayName": "ウインディ",
    "name": {
      "en": "Arcanine",
      "ja": "ウインディ",
      "jaHrkt": "ウインディ"
    },
    "championsTarget": true,
    "types": [
      "fire"
    ],
    "baseStats": {
      "hp": 90,
      "atk": 110,
      "def": 80,
      "spa": 100,
      "spd": 80,
      "spe": 95
    },
    "isFinalEvolution": true
  },
  "learnset": {
    "moveIds": [
      "aerial-ace",
      "bite",
      "body-slam",
      "bulldoze",
      "burn-up",
      "close-combat",
      "covet",
      "crunch",
      "dig",
      "double-edge",
      "dragon-breath",
      "dragon-pulse",
      "ember",
      "extreme-speed",
      "facade",
      "fire-blast",
      "fire-fang",
      "fire-spin",
      "flame-charge",
      "flame-wheel",
      "flamethrower",
      "flare-blitz",
      "giga-impact",
      "headbutt",
      "heat-wave",
      "hidden-power",
      "hyper-beam",
      "hyper-voice",
      "incinerate",
      "iron-head",
      "iron-tail",
      "mud-slap",
      "outrage",
      "overheat",
      "play-rough",
      "psychic-fangs",
      "rage",
      "raging-fury",
      "retaliate",
      "rock-climb",
      "rock-smash",
      "round",
      "scorching-sands",
      "secret-power",
      "skull-bash",
      "snarl",
      "snore",
      "solar-beam",
      "strength",
      "superpower",
      "swift",
      "take-down",
      "temper-flare",
      "tera-blast",
      "thief",
      "thrash",
      "thunder-fang",
      "wild-charge"
    ],
    "specialMoves": [],
    "verification": {
      "status": "inherited-unverified",
      "sources": [],
      "verifiedMoveIds": [],
      "rejectedMoveIds": [],
      "notes": []
    }
  },
  "weight": {
    "kg": null,
    "verification": {
      "status": "not-recorded",
      "sources": [],
      "notes": []
    }
  },
  "abilities": [],
  "battleEffects": [],
  "research": {
    "profileStatus": "inherited-unverified",
    "battleEffectsStatus": "inherited-unverified",
    "sources": [],
    "notes": []
  },
  "extensions": {}
}
