{
  "$schema": "../schema.json",
  "schemaVersion": 1,
  "pokemon": {
    "id": "salamence",
    "dexNumber": 373,
    "displayName": "ボーマンダ",
    "name": {
      "en": "Salamence",
      "ja": "ボーマンダ",
      "jaHrkt": "ボーマンダ"
    },
    "championsTarget": true,
    "types": [
      "dragon",
      "flying"
    ],
    "baseStats": {
      "hp": 95,
      "atk": 135,
      "def": 80,
      "spa": 110,
      "spd": 80,
      "spe": 100
    },
    "isFinalEvolution": true
  },
  "learnset": {
    "moveIds": [
      "giga-impact",
      "double-edge",
      "thrash",
      "body-slam",
      "slash",
      "facade",
      "hyper-beam",
      "hyper-voice",
      "round",
      "snore",
      "helping-hand",
      "sleep-talk",
      "endure",
      "protect",
      "substitute",
      "temper-flare",
      "fire-blast",
      "fire-fang",
      "heat-wave",
      "flamethrower",
      "fire-spin",
      "sunny-day",
      "hydro-pump",
      "rain-dance",
      "thunder-fang",
      "fly",
      "aerial-ace",
      "dual-wingbeat",
      "hurricane",
      "air-slash",
      "stone-edge",
      "rock-slide",
      "rock-tomb",
      "earthquake",
      "bulldoze",
      "mud-slap",
      "brick-break",
      "psychic-fangs",
      "zen-headbutt",
      "rest",
      "shadow-claw",
      "outrage",
      "dragon-rush",
      "dragon-claw",
      "breaking-swipe",
      "dragon-tail",
      "draco-meteor",
      "dragon-pulse",
      "crunch",
      "brutal-swing",
      "bite",
      "steel-wing",
      "iron-head",
      "iron-tail"
    ],
    "specialMoves": [
      {
        "id": "scary-face",
        "name": "こわいかお",
        "type": "normal",
        "category": "status",
        "power": 0,
        "searchable": false,
        "isContactMove": false,
        "moveCategories": []
      },
      {
        "id": "focus-energy",
        "name": "きあいだめ",
        "type": "normal",
        "category": "status",
        "power": 0,
        "searchable": false,
        "isContactMove": false,
        "moveCategories": []
      },
      {
        "id": "roar",
        "name": "ほえる",
        "type": "normal",
        "category": "status",
        "power": 0,
        "searchable": false,
        "isContactMove": false,
        "moveCategories": []
      },
      {
        "id": "tailwind",
        "name": "おいかぜ",
        "type": "flying",
        "category": "status",
        "power": 0,
        "searchable": false,
        "isContactMove": false,
        "moveCategories": []
      },
      {
        "id": "roost",
        "name": "はねやすめ",
        "type": "flying",
        "category": "status",
        "power": 0,
        "searchable": false,
        "isContactMove": false,
        "moveCategories": [
          "heal"
        ]
      },
      {
        "id": "dragon-cheer",
        "name": "ドラゴンエール",
        "type": "dragon",
        "category": "status",
        "power": 0,
        "searchable": false,
        "isContactMove": false,
        "moveCategories": []
      },
      {
        "id": "dragon-dance",
        "name": "りゅうのまい",
        "type": "dragon",
        "category": "status",
        "power": 0,
        "searchable": false,
        "isContactMove": false,
        "moveCategories": [
          "dance"
        ]
      },
      {
        "id": "iron-defense",
        "name": "てっぺき",
        "type": "steel",
        "category": "status",
        "power": 0,
        "searchable": false,
        "isContactMove": false,
        "moveCategories": []
      }
    ],
    "verification": {
      "status": "verified",
      "sources": [
        "local-input/videos/2026-09-11 22-24-42.mkv"
      ],
      "verifiedMoveIds": [
        "giga-impact",
        "double-edge",
        "thrash",
        "body-slam",
        "slash",
        "facade",
        "hyper-beam",
        "hyper-voice",
        "round",
        "snore",
        "helping-hand",
        "sleep-talk",
        "endure",
        "scary-face",
        "protect",
        "substitute",
        "focus-energy",
        "roar",
        "temper-flare",
        "fire-blast",
        "fire-fang",
        "heat-wave",
        "flamethrower",
        "fire-spin",
        "sunny-day",
        "hydro-pump",
        "rain-dance",
        "thunder-fang",
        "fly",
        "aerial-ace",
        "dual-wingbeat",
        "hurricane",
        "air-slash",
        "tailwind",
        "roost",
        "stone-edge",
        "rock-slide",
        "rock-tomb",
        "earthquake",
        "bulldoze",
        "mud-slap",
        "brick-break",
        "psychic-fangs",
        "zen-headbutt",
        "rest",
        "shadow-claw",
        "outrage",
        "dragon-rush",
        "dragon-claw",
        "breaking-swipe",
        "dragon-tail",
        "draco-meteor",
        "dragon-pulse",
        "dragon-cheer",
        "dragon-dance",
        "crunch",
        "brutal-swing",
        "bite",
        "iron-defense",
        "steel-wing",
        "iron-head",
        "iron-tail"
      ],
      "rejectedMoveIds": [],
      "notes": [
        "ゲーム内の「教える技」一覧を動画で全件確認（全62技）。",
        "耐久ラインサーチには固定威力の攻撃技46件だけを同期。変化技・未対応の変動威力技は個別記録のみに保存。"
      ]
    }
  },
  "weight": {
    "kg": null,
    "verification": {
      "status": "not-recorded",
      "sources": [],
      "notes": []
    }
  },
  "abilities": [],
  "battleEffects": [],
  "research": {
    "profileStatus": "inherited-unverified",
    "battleEffectsStatus": "inherited-unverified",
    "sources": [],
    "notes": []
  },
  "extensions": {}
}
