{
  "$schema": "../schema.json",
  "schemaVersion": 1,
  "pokemon": {
    "id": "golisopod",
    "dexNumber": 768,
    "displayName": "グソクムシャ",
    "name": {
      "en": "Golisopod",
      "ja": "グソクムシャ",
      "jaHrkt": "グソクムシャ"
    },
    "championsTarget": true,
    "types": [
      "bug",
      "water"
    ],
    "baseStats": {
      "hp": 75,
      "atk": 125,
      "def": 140,
      "spa": 60,
      "spd": 90,
      "spe": 40
    },
    "isFinalEvolution": true
  },
  "learnset": {
    "moveIds": [
      "giga-impact",
      "slash",
      "facade",
      "double-hit",
      "hyper-beam",
      "round",
      "snore",
      "sleep-talk",
      "endure",
      "protect",
      "substitute",
      "liquidation",
      "dive",
      "waterfall",
      "razor-shell",
      "aqua-jet",
      "muddy-water",
      "surf",
      "scald",
      "chilling-water",
      "rain-dance",
      "first-impression",
      "x-scissor",
      "leech-life",
      "skitter-smack",
      "u-turn",
      "bug-bite",
      "pounce",
      "pin-missile",
      "bug-buzz",
      "struggle-bug",
      "rock-slide",
      "rock-tomb",
      "gunk-shot",
      "poison-jab",
      "sludge-wave",
      "sludge-bomb",
      "venoshock",
      "drill-run",
      "mud-shot",
      "blizzard",
      "ice-beam",
      "icy-wind",
      "close-combat",
      "brick-break",
      "focus-blast",
      "rest",
      "sucker-punch",
      "night-slash",
      "throat-chop",
      "shadow-claw",
      "lash-out",
      "payback",
      "dark-pulse",
      "snarl",
      "iron-head"
    ],
    "specialMoves": [
      {
        "id": "attract",
        "name": "メロメロ",
        "type": "normal",
        "category": "status",
        "power": 0,
        "searchable": false,
        "isContactMove": false,
        "moveCategories": []
      },
      {
        "id": "screech",
        "name": "いやなおと",
        "type": "normal",
        "category": "status",
        "power": 0,
        "searchable": false,
        "isContactMove": false,
        "moveCategories": []
      },
      {
        "id": "swords-dance",
        "name": "つるぎのまい",
        "type": "normal",
        "category": "status",
        "power": 0,
        "searchable": false,
        "isContactMove": false,
        "moveCategories": [
          "dance"
        ]
      },
      {
        "id": "wide-guard",
        "name": "ワイドガード",
        "type": "rock",
        "category": "status",
        "power": 0,
        "searchable": false,
        "isContactMove": false,
        "moveCategories": []
      },
      {
        "id": "spikes",
        "name": "まきびし",
        "type": "ground",
        "category": "status",
        "power": 0,
        "searchable": false,
        "isContactMove": false,
        "moveCategories": []
      },
      {
        "id": "bulk-up",
        "name": "ビルドアップ",
        "type": "fighting",
        "category": "status",
        "power": 0,
        "searchable": false,
        "isContactMove": false,
        "moveCategories": []
      },
      {
        "id": "agility",
        "name": "こうそくいどう",
        "type": "psychic",
        "category": "status",
        "power": 0,
        "searchable": false,
        "isContactMove": false,
        "moveCategories": []
      },
      {
        "id": "spite",
        "name": "うらみ",
        "type": "ghost",
        "category": "status",
        "power": 0,
        "searchable": false,
        "isContactMove": false,
        "moveCategories": []
      },
      {
        "id": "fling",
        "name": "なげつける",
        "type": "dark",
        "category": "physical",
        "power": 0,
        "searchable": false,
        "isContactMove": false,
        "moveCategories": []
      },
      {
        "id": "taunt",
        "name": "ちょうはつ",
        "type": "dark",
        "category": "status",
        "power": 0,
        "searchable": false,
        "isContactMove": false,
        "moveCategories": []
      },
      {
        "id": "iron-defense",
        "name": "てっぺき",
        "type": "steel",
        "category": "status",
        "power": 0,
        "searchable": false,
        "isContactMove": false,
        "moveCategories": []
      }
    ],
    "verification": {
      "status": "verified",
      "sources": [
        "local-input/videos/2026-09-11 22-24-42.mkv"
      ],
      "verifiedMoveIds": [
        "giga-impact",
        "slash",
        "facade",
        "double-hit",
        "hyper-beam",
        "round",
        "snore",
        "sleep-talk",
        "attract",
        "endure",
        "protect",
        "substitute",
        "screech",
        "swords-dance",
        "liquidation",
        "dive",
        "waterfall",
        "razor-shell",
        "aqua-jet",
        "muddy-water",
        "surf",
        "scald",
        "chilling-water",
        "rain-dance",
        "first-impression",
        "x-scissor",
        "leech-life",
        "skitter-smack",
        "u-turn",
        "bug-bite",
        "pounce",
        "pin-missile",
        "bug-buzz",
        "struggle-bug",
        "rock-slide",
        "rock-tomb",
        "wide-guard",
        "gunk-shot",
        "poison-jab",
        "sludge-wave",
        "sludge-bomb",
        "venoshock",
        "drill-run",
        "mud-shot",
        "spikes",
        "blizzard",
        "ice-beam",
        "icy-wind",
        "close-combat",
        "brick-break",
        "focus-blast",
        "bulk-up",
        "rest",
        "agility",
        "sucker-punch",
        "night-slash",
        "throat-chop",
        "spite",
        "shadow-claw",
        "lash-out",
        "payback",
        "fling",
        "dark-pulse",
        "snarl",
        "taunt",
        "iron-head",
        "iron-defense"
      ],
      "rejectedMoveIds": [],
      "notes": [
        "ゲーム内の「教える技」一覧を動画で全件確認（全67技）。",
        "耐久ラインサーチには固定威力の攻撃技50件だけを同期。変化技・未対応の変動威力技は個別記録のみに保存。"
      ]
    }
  },
  "weight": {
    "kg": null,
    "verification": {
      "status": "not-recorded",
      "sources": [],
      "notes": []
    }
  },
  "abilities": [],
  "battleEffects": [],
  "research": {
    "profileStatus": "inherited-unverified",
    "battleEffectsStatus": "inherited-unverified",
    "sources": [],
    "notes": []
  },
  "extensions": {}
}
