{
  "$schema": "../schema.json",
  "schemaVersion": 1,
  "pokemon": {
    "id": "absol-mega-z",
    "dexNumber": 359,
    "displayName": "メガアブソルZ",
    "name": {
      "en": "Absol",
      "ja": "メガアブソルZ",
      "jaHrkt": "メガアブソルZ"
    },
    "championsTarget": true,
    "types": [
      "dark",
      "ghost"
    ],
    "baseStats": {
      "hp": 65,
      "atk": 154,
      "def": 60,
      "spa": 75,
      "spd": 60,
      "spe": 151
    },
    "isFinalEvolution": true
  },
  "learnset": {
    "moveIds": [
      "aerial-ace",
      "air-slash",
      "assurance",
      "bite",
      "blizzard",
      "body-slam",
      "bounce",
      "brutal-swing",
      "charge-beam",
      "close-combat",
      "cut",
      "dark-pulse",
      "double-edge",
      "dream-eater",
      "echoed-voice",
      "facade",
      "false-swipe",
      "feint",
      "feint-attack",
      "fire-blast",
      "flamethrower",
      "foul-play",
      "fury-cutter",
      "future-sight",
      "giga-impact",
      "headbutt",
      "hex",
      "hidden-power",
      "hyper-beam",
      "ice-beam",
      "icy-wind",
      "incinerate",
      "iron-tail",
      "knock-off",
      "megahorn",
      "mud-slap",
      "night-slash",
      "payback",
      "phantom-force",
      "play-rough",
      "psycho-cut",
      "pursuit",
      "quick-attack",
      "razor-wind",
      "retaliate",
      "rock-slide",
      "rock-smash",
      "rock-tomb",
      "round",
      "scratch",
      "secret-power",
      "shadow-ball",
      "shadow-claw",
      "shadow-sneak",
      "shock-wave",
      "slash",
      "snarl",
      "snore",
      "stone-edge",
      "strength",
      "sucker-punch",
      "superpower",
      "swift",
      "thief",
      "throat-chop",
      "thunder",
      "thunderbolt",
      "trailblaze",
      "water-pulse",
      "x-scissor",
      "zen-headbutt"
    ],
    "specialMoves": [],
    "verification": {
      "status": "inherited-unverified",
      "sources": [],
      "verifiedMoveIds": [],
      "rejectedMoveIds": [],
      "notes": []
    }
  },
  "weight": {
    "kg": null,
    "verification": {
      "status": "not-recorded",
      "sources": [],
      "notes": []
    }
  },
  "abilities": [],
  "battleEffects": [],
  "research": {
    "profileStatus": "inherited-unverified",
    "battleEffectsStatus": "inherited-unverified",
    "sources": [],
    "notes": []
  },
  "extensions": {}
}
