{
  "$schema": "../schema.json",
  "schemaVersion": 1,
  "pokemon": {
    "id": "starmie-mega",
    "dexNumber": 121,
    "displayName": "メガスターミー",
    "name": {
      "en": "Starmie",
      "ja": "メガスターミー",
      "jaHrkt": "メガスターミー"
    },
    "championsTarget": true,
    "types": [
      "water",
      "psychic"
    ],
    "baseStats": {
      "hp": 60,
      "atk": 100,
      "def": 105,
      "spa": 130,
      "spd": 105,
      "spe": 120
    },
    "isFinalEvolution": true
  },
  "learnset": {
    "moveIds": [
      "ancient-power",
      "aqua-jet",
      "avalanche",
      "blizzard",
      "brine",
      "bubble-beam",
      "charge-beam",
      "chilling-water",
      "dazzling-gleam",
      "dive",
      "double-edge",
      "dream-eater",
      "expanding-force",
      "facade",
      "flash-cannon",
      "flip-turn",
      "giga-impact",
      "headbutt",
      "hidden-power",
      "hydro-pump",
      "hyper-beam",
      "ice-beam",
      "ice-spinner",
      "icy-wind",
      "liquidation",
      "meteor-beam",
      "power-gem",
      "psybeam",
      "psychic",
      "psycho-cut",
      "psyshock",
      "rage",
      "rapid-spin",
      "rollout",
      "round",
      "scald",
      "secret-power",
      "self-destruct",
      "signal-beam",
      "skull-bash",
      "snore",
      "surf",
      "swift",
      "tackle",
      "take-down",
      "thunder",
      "thunderbolt",
      "tri-attack",
      "twister",
      "water-gun",
      "water-pulse",
      "waterfall",
      "whirlpool",
      "zap-cannon",
      "zen-headbutt"
    ],
    "specialMoves": [],
    "verification": {
      "status": "inherited-unverified",
      "sources": [],
      "verifiedMoveIds": [],
      "rejectedMoveIds": [],
      "notes": []
    }
  },
  "weight": {
    "kg": 80,
    "verification": {
      "status": "verified",
      "sources": [
        "https://pokeapi.co/api/v2/pokemon/starmie-mega"
      ],
      "notes": [
        "PokéAPIのweight（ヘクトグラム）をkgへ換算。"
      ]
    }
  },
  "abilities": [],
  "battleEffects": [
    {
      "scope": "attacker",
      "effectKey": "hugePower",
      "definition": {
        "abilityId": "huge-power",
        "abilityName": "ちからもち",
        "stage": "attack",
        "moveCategories": [
          "physical"
        ],
        "modifier": 2
      }
    }
  ],
  "research": {
    "profileStatus": "inherited-unverified",
    "battleEffectsStatus": "inherited-unverified",
    "sources": [],
    "notes": []
  },
  "extensions": {}
}
