{
  "$schema": "../schema.json",
  "schemaVersion": 1,
  "pokemon": {
    "id": "tyranitar",
    "dexNumber": 248,
    "displayName": "バンギラス",
    "name": {
      "en": "Tyranitar",
      "ja": "バンギラス",
      "jaHrkt": "バンギラス"
    },
    "championsTarget": true,
    "types": [
      "rock",
      "dark"
    ],
    "baseStats": {
      "hp": 100,
      "atk": 134,
      "def": 110,
      "spa": 95,
      "spd": 100,
      "spe": 61
    },
    "isFinalEvolution": true
  },
  "learnset": {
    "moveIds": [
      "aerial-ace",
      "ancient-power",
      "aqua-tail",
      "assurance",
      "avalanche",
      "bite",
      "blizzard",
      "body-press",
      "body-slam",
      "breaking-swipe",
      "brick-break",
      "brutal-swing",
      "bulldoze",
      "chip-away",
      "crunch",
      "cut",
      "dark-pulse",
      "dig",
      "double-edge",
      "dragon-breath",
      "dragon-claw",
      "dragon-pulse",
      "dragon-tail",
      "dynamic-punch",
      "earth-power",
      "earthquake",
      "facade",
      "fire-blast",
      "fire-fang",
      "fire-punch",
      "flamethrower",
      "focus-blast",
      "focus-punch",
      "foul-play",
      "fury-cutter",
      "giga-impact",
      "headbutt",
      "hidden-power",
      "high-horsepower",
      "hydro-pump",
      "hyper-beam",
      "ice-beam",
      "ice-fang",
      "ice-punch",
      "icy-wind",
      "incinerate",
      "iron-head",
      "iron-tail",
      "knock-off",
      "lash-out",
      "mega-kick",
      "mega-punch",
      "mud-shot",
      "mud-slap",
      "muddy-water",
      "outrage",
      "payback",
      "power-gem",
      "power-up-punch",
      "retaliate",
      "revenge",
      "rock-blast",
      "rock-climb",
      "rock-slide",
      "rock-smash",
      "rock-throw",
      "rock-tomb",
      "round",
      "sand-tomb",
      "secret-power",
      "shadow-claw",
      "shock-wave",
      "smack-down",
      "snarl",
      "snore",
      "stomping-tantrum",
      "stone-edge",
      "strength",
      "superpower",
      "surf",
      "tackle",
      "take-down",
      "tera-blast",
      "thrash",
      "thunder",
      "thunder-fang",
      "thunder-punch",
      "thunderbolt",
      "uproar",
      "water-pulse",
      "whirlpool"
    ],
    "specialMoves": [],
    "verification": {
      "status": "inherited-unverified",
      "sources": [],
      "verifiedMoveIds": [],
      "rejectedMoveIds": [],
      "notes": []
    }
  },
  "weight": {
    "kg": 202,
    "verification": {
      "status": "verified",
      "sources": [
        "https://pokeapi.co/api/v2/pokemon/tyranitar"
      ],
      "notes": [
        "PokéAPIのweight（ヘクトグラム）をkgへ換算。"
      ]
    }
  },
  "abilities": [],
  "battleEffects": [
    {
      "scope": "weatherSetter",
      "effectKey": "sand",
      "definition": {
        "abilityId": "sand-stream",
        "abilityName": "すなおこし"
      }
    }
  ],
  "research": {
    "profileStatus": "inherited-unverified",
    "battleEffectsStatus": "inherited-unverified",
    "sources": [],
    "notes": []
  },
  "extensions": {}
}
